{
  "$schema": "./ui.schema.json",
  "version": 1,
  "_readme": [
    "ZedScope UI 定制配置（planned feature 的默认档）。可直接手改本文件后重装 App，",
    "也可在起始页点「界面定制」用 ui-config.html 可视化编辑并保存。",
    "生效范围：theme.* / blocks.home.* / blocks.browser.* / bookmarks / search 已由",
    "WebView 起始页实时读取；blocks.topbar / capture / token / ai / settings / bottomNav",
    "为原生侧预留字段，等 MainActivity 接入 UiConfig 读取后生效（见 ui.schema.json 的 x-scope）。",
    "保存优先级：localStorage['zedscope.ui.config'] > assets/ui.json > 内置默认值。"
  ],
  "meta": {
    "name": "ZedScope default",
    "author": "UI 设计部",
    "updatedAt": ""
  },
  "theme": {
    "mode": "dark",
    "monet": false,
    "accent": "#D9A45B",
    "accentDim": "#B9843F",
    "background": "#171513",
    "surface": "#1E1C19",
    "radius": 14,
    "density": "normal",
    "motion": true
  },
  "blocks": {
    "topbar": {
      "visible": true,
      "showBack": true,
      "showForward": true,
      "showReload": true,
      "showShield": true,
      "style": "pill"
    },
    "home": {
      "visible": true,
      "showBrand": true,
      "showStatus": true,
      "showSearch": true,
      "showQuickActions": true,
      "showCaHint": true,
      "showBookmarks": true,
      "bookmarkColumns": 2
    },
    "browser": {
      "visible": true,
      "showProgress": true,
      "showCaptureBanner": true,
      "homeUrl": "file:///android_asset/home.html"
    },
    "capture": {
      "visible": true,
      "showStats": true,
      "showMethodChip": true,
      "showSchemeTag": true,
      "showLoginFlag": true,
      "cleanCapture": true,
      "pageSize": 200
    },
    "token": {
      "visible": true,
      "showSource": true,
      "maskValue": false
    },
    "ai": {
      "visible": true,
      "showCompact": true,
      "showSession": true,
      "showQuickChips": true
    },
    "settings": {
      "visible": true,
      "showVpn": true,
      "showCert": true,
      "showAbout": true
    },
    "bottomNav": {
      "visible": true,
      "labels": true,
      "items": ["browser", "capture", "ai", "token", "settings"]
    }
  },
  "search": {
    "engine": "bing",
    "template": "https://www.bing.com/search?q=%s"
  },
  "bookmarks": [
    { "title": "百度", "url": "https://www.baidu.com" },
    { "title": "Bing", "url": "https://www.bing.com" },
    { "title": "GitHub", "url": "https://github.com" },
    { "title": "DeepSeek", "url": "https://chat.deepseek.com" }
  ]
}
